{
  "schemaVersion": 1,
  "workspace": {
    "workspaceId": "demo-v1",
    "workspaceType": "DEMO",
    "scenarioId": "schedule-approval-basic",
    "seedVersion": 1,
    "publicationRevision": 1,
    "externalEffectsAllowed": false,
    "notificationsEnabled": false
  },
  "teams": [
    {
      "id": "team-demo-soc",
      "workspaceId": "demo-v1",
      "name": "SOC Demonstração",
      "acronym": "SOC-DEMO",
      "active": true,
      "schemaVersion": 1
    },
    {
      "id": "team-demo-seguranca",
      "workspaceId": "demo-v1",
      "name": "Segurança da Informação Demonstração",
      "acronym": "SEG-DEMO",
      "active": true,
      "schemaVersion": 1
    }
  ],
  "members": [
    {
      "id": "member-demo-gestor-seguranca",
      "workspaceId": "demo-v1",
      "displayName": "Gestor de Segurança Demo",
      "corporateLogin": "gestor.seguranca.demo",
      "emailNormalized": "gestor.seguranca.demo@example.invalid",
      "active": true,
      "schemaVersion": 1
    },
    {
      "id": "member-demo-soc-01",
      "workspaceId": "demo-v1",
      "displayName": "Analista SOC Demo 1",
      "corporateLogin": "analista.soc.demo1",
      "emailNormalized": "analista.soc.demo1@example.invalid",
      "active": true,
      "schemaVersion": 1
    },
    {
      "id": "member-demo-soc-02",
      "workspaceId": "demo-v1",
      "displayName": "Analista SOC Demo 2",
      "corporateLogin": "analista.soc.demo2",
      "emailNormalized": "analista.soc.demo2@example.invalid",
      "active": true,
      "schemaVersion": 1
    },
    {
      "id": "member-demo-seguranca-01",
      "workspaceId": "demo-v1",
      "displayName": "Analista de Segurança Demo 1",
      "corporateLogin": "analista.seguranca.demo1",
      "emailNormalized": "analista.seguranca.demo1@example.invalid",
      "active": true,
      "schemaVersion": 1
    },
    {
      "id": "member-demo-seguranca-02",
      "workspaceId": "demo-v1",
      "displayName": "Analista de Segurança Demo 2",
      "corporateLogin": "analista.seguranca.demo2",
      "emailNormalized": "analista.seguranca.demo2@example.invalid",
      "active": true,
      "schemaVersion": 1
    }
  ],
  "memberTeamMemberships": [
    {
      "id": "membership-demo-gestor-seguranca",
      "workspaceId": "demo-v1",
      "memberId": "member-demo-gestor-seguranca",
      "teamId": "team-demo-seguranca",
      "startDate": "2020-01-01",
      "endDate": null,
      "active": true,
      "isPrimary": true,
      "schemaVersion": 1
    },
    {
      "id": "membership-demo-soc-01",
      "workspaceId": "demo-v1",
      "memberId": "member-demo-soc-01",
      "teamId": "team-demo-soc",
      "startDate": "2020-01-01",
      "endDate": null,
      "active": true,
      "isPrimary": true,
      "schemaVersion": 1
    },
    {
      "id": "membership-demo-soc-02",
      "workspaceId": "demo-v1",
      "memberId": "member-demo-soc-02",
      "teamId": "team-demo-soc",
      "startDate": "2020-01-01",
      "endDate": null,
      "active": true,
      "isPrimary": true,
      "schemaVersion": 1
    },
    {
      "id": "membership-demo-seguranca-01",
      "workspaceId": "demo-v1",
      "memberId": "member-demo-seguranca-01",
      "teamId": "team-demo-seguranca",
      "startDate": "2020-01-01",
      "endDate": null,
      "active": true,
      "isPrimary": true,
      "schemaVersion": 1
    },
    {
      "id": "membership-demo-seguranca-02",
      "workspaceId": "demo-v1",
      "memberId": "member-demo-seguranca-02",
      "teamId": "team-demo-seguranca",
      "startDate": "2020-01-01",
      "endDate": null,
      "active": true,
      "isPrimary": true,
      "schemaVersion": 1
    }
  ],
  "teamManagerAssignments": [
    {
      "id": "manager-demo-seguranca",
      "workspaceId": "demo-v1",
      "managerMemberId": "member-demo-gestor-seguranca",
      "teamId": "team-demo-seguranca",
      "role": "PRIMARY_MANAGER",
      "permissions": {
        "viewTeamSchedule": true,
        "viewTeamMembers": true,
        "editTeamSchedule": false,
        "approveScheduleChanges": true,
        "publishSchedule": false,
        "manageTeamAssignments": false
      },
      "active": true,
      "validFrom": "2026-07-01",
      "validTo": null,
      "createdAt": "2026-07-01T09:00:00Z",
      "updatedAt": "2026-07-01T09:00:00Z",
      "createdBy": "demo-admin@example.invalid",
      "schemaVersion": 1
    },
    {
      "id": "manager-demo-soc",
      "workspaceId": "demo-v1",
      "managerMemberId": "member-demo-gestor-seguranca",
      "teamId": "team-demo-soc",
      "role": "PRIMARY_APPROVER",
      "permissions": {
        "viewTeamSchedule": true,
        "viewTeamMembers": true,
        "editTeamSchedule": false,
        "approveScheduleChanges": true,
        "publishSchedule": false,
        "manageTeamAssignments": false
      },
      "active": true,
      "validFrom": "2026-07-01",
      "validTo": null,
      "createdAt": "2026-07-01T09:00:00Z",
      "updatedAt": "2026-07-01T09:00:00Z",
      "createdBy": "demo-admin@example.invalid",
      "schemaVersion": 1
    }
  ],
  "scheduleChangeRequests": [
    {
      "id": "request-demo-pending-001",
      "workspaceId": "demo-v1",
      "requesterMemberId": "member-demo-soc-01",
      "requesterTeamId": "team-demo-soc",
      "assignedManagerMemberId": "member-demo-gestor-seguranca",
      "schedulePeriodId": "period-demo-soc-2026-07-26-2026-08-25",
      "assignmentId": "assignment-demo-soc-01-2026-07-31",
      "requestType": "SHIFT_CHANGE",
      "status": "PENDING",
      "reason": "Consulta médica agendada",
      "createdAt": "2026-07-30T09:00:00Z",
      "resolvedAt": null,
      "resolvedByMemberId": null,
      "resolutionNote": null,
      "schemaVersion": 1
    },
    {
      "id": "request-demo-approved-001",
      "workspaceId": "demo-v1",
      "requesterMemberId": "member-demo-seguranca-01",
      "requesterTeamId": "team-demo-seguranca",
      "assignedManagerMemberId": "member-demo-gestor-seguranca",
      "schedulePeriodId": "period-demo-seguranca-2026-07-26-2026-08-25",
      "assignmentId": "assignment-demo-seguranca-01-2026-08-05",
      "requestType": "DAY_OFF_CHANGE",
      "status": "APPROVED",
      "reason": "Troca de folga por compromisso pessoal",
      "createdAt": "2026-08-02T10:00:00Z",
      "resolvedAt": "2026-08-02T15:00:00Z",
      "resolvedByMemberId": "member-demo-gestor-seguranca",
      "resolutionNote": "Aprovado - sem impacto na cobertura da equipe.",
      "schemaVersion": 1
    },
    {
      "id": "request-demo-rejected-001",
      "workspaceId": "demo-v1",
      "requesterMemberId": "member-demo-soc-02",
      "requesterTeamId": "team-demo-soc",
      "assignedManagerMemberId": "member-demo-gestor-seguranca",
      "schedulePeriodId": "period-demo-soc-2026-07-26-2026-08-25",
      "assignmentId": "assignment-demo-soc-02-2026-08-07",
      "requestType": "SCHEDULE_CORRECTION",
      "status": "REJECTED",
      "reason": "Turno registrado incorretamente",
      "createdAt": "2026-08-04T09:00:00Z",
      "resolvedAt": "2026-08-04T14:00:00Z",
      "resolvedByMemberId": "member-demo-gestor-seguranca",
      "resolutionNote": "Recusado - turno confere com o planejamento original da equipe.",
      "schemaVersion": 1
    }
  ],
  "schedulePeriods": [
    {
      "id": "period-demo-soc-2026-07-26-2026-08-25",
      "workspaceId": "demo-v1",
      "teamId": "team-demo-soc",
      "name": "SOC Demonstração - 2026-07-26 a 2026-08-25",
      "startDate": "2026-07-26",
      "endDate": "2026-08-25",
      "active": true,
      "publicationRevision": 1,
      "schemaVersion": 1
    },
    {
      "id": "period-demo-seguranca-2026-07-26-2026-08-25",
      "workspaceId": "demo-v1",
      "teamId": "team-demo-seguranca",
      "name": "Segurança da Informação Demonstração - 2026-07-26 a 2026-08-25",
      "startDate": "2026-07-26",
      "endDate": "2026-08-25",
      "active": true,
      "publicationRevision": 1,
      "schemaVersion": 1
    }
  ],
  "scheduleAssignments": [
    {
      "id": "assignment-demo-seguranca-01-2026-07-26",
      "workspaceId": "demo-v1",
      "periodId": "period-demo-seguranca-2026-07-26-2026-08-25",
      "teamId": "team-demo-seguranca",
      "memberId": "member-demo-seguranca-01",
      "date": "2026-07-26",
      "assignmentType": "OFF",
      "shiftName": null,
      "startTime": null,
      "endTime": null,
      "schemaVersion": 1
    },
    {
      "id": "assignment-demo-seguranca-01-2026-07-27",
      "workspaceId": "demo-v1",
      "periodId": "period-demo-seguranca-2026-07-26-2026-08-25",
      "teamId": "team-demo-seguranca",
      "memberId": "member-demo-seguranca-01",
      "date": "2026-07-27",
      "assignmentType": "WORK_SHIFT",
      "shiftName": "Comercial",
      "startTime": "08:00",
      "endTime": "18:00",
      "schemaVersion": 1
    },
    {
      "id": "assignment-demo-seguranca-01-2026-07-28",
      "workspaceId": "demo-v1",
      "periodId": "period-demo-seguranca-2026-07-26-2026-08-25",
      "teamId": "team-demo-seguranca",
      "memberId": "member-demo-seguranca-01",
      "date": "2026-07-28",
      "assignmentType": "WORK_SHIFT",
      "shiftName": "Comercial",
      "startTime": "08:00",
      "endTime": "18:00",
      "schemaVersion": 1
    },
    {
      "id": "assignment-demo-seguranca-01-2026-07-29",
      "workspaceId": "demo-v1",
      "periodId": "period-demo-seguranca-2026-07-26-2026-08-25",
      "teamId": "team-demo-seguranca",
      "memberId": "member-demo-seguranca-01",
      "date": "2026-07-29",
      "assignmentType": "WORK_SHIFT",
      "shiftName": "Comercial",
      "startTime": "08:00",
      "endTime": "18:00",
      "schemaVersion": 1
    },
    {
      "id": "assignment-demo-seguranca-01-2026-07-30",
      "workspaceId": "demo-v1",
      "periodId": "period-demo-seguranca-2026-07-26-2026-08-25",
      "teamId": "team-demo-seguranca",
      "memberId": "member-demo-seguranca-01",